{
  "$schema": "https://json-schema.org/draft/2020-12/schema",
  "$id": "https://shortsmith.local/schemas/editorial-video/story-package.schema.json",
  "title": "Editorial story package",
  "type": "object",
  "additionalProperties": false,
  "required": [
    "version",
    "episodeId",
    "title",
    "thesis",
    "audiencePromise",
    "narrativeTemplate",
    "hook",
    "beats",
    "scriptSections",
    "claimRefs",
    "sourceRefs",
    "estimatedDurationSeconds",
    "disclaimerRefs",
    "dossierRevision",
    "dossierSha256",
    "approval",
    "generatedAt"
  ],
  "properties": {
    "version": {
      "const": 1
    },
    "episodeId": {
      "$ref": "#/$defs/episodeId"
    },
    "title": {
      "type": "string",
      "minLength": 1,
      "maxLength": 200
    },
    "thesis": {
      "type": "string",
      "minLength": 1,
      "maxLength": 1000
    },
    "audiencePromise": {
      "type": "string",
      "minLength": 1,
      "maxLength": 500
    },
    "narrativeTemplate": {
      "enum": [
        "causal-explainer",
        "market-move",
        "macro-chain",
        "policy-impact",
        "company-event",
        "myth-vs-data"
      ]
    },
    "hook": {
      "type": "string",
      "minLength": 1,
      "maxLength": 600
    },
    "beats": {
      "type": "array",
      "minItems": 2,
      "maxItems": 30,
      "items": {
        "type": "object",
        "additionalProperties": false,
        "required": [
          "id",
          "order",
          "narrativeFunction",
          "claimRefs",
          "emotion",
          "visualObjective",
          "estimatedDurationSeconds"
        ],
        "properties": {
          "id": {
            "$ref": "#/$defs/id"
          },
          "order": {
            "type": "integer",
            "minimum": 0
          },
          "narrativeFunction": {
            "enum": [
              "hook",
              "context",
              "question",
              "cause",
              "mechanism",
              "evidence",
              "counterpoint",
              "consequence",
              "resolution",
              "conclusion"
            ]
          },
          "claimRefs": {
            "$ref": "#/$defs/idList"
          },
          "emotion": {
            "type": "string",
            "minLength": 1,
            "maxLength": 120
          },
          "visualObjective": {
            "type": "string",
            "minLength": 1,
            "maxLength": 500
          },
          "estimatedDurationSeconds": {
            "type": "number",
            "exclusiveMinimum": 0,
            "maximum": 600
          }
        }
      }
    },
    "scriptSections": {
      "type": "array",
      "minItems": 1,
      "maxItems": 100,
      "items": {
        "type": "object",
        "additionalProperties": false,
        "required": [
          "id",
          "order",
          "heading",
          "text",
          "claimRefs",
          "sourceRefs"
        ],
        "properties": {
          "id": {
            "$ref": "#/$defs/id"
          },
          "order": {
            "type": "integer",
            "minimum": 0
          },
          "heading": {
            "type": [
              "string",
              "null"
            ],
            "maxLength": 160
          },
          "text": {
            "type": "string",
            "minLength": 1,
            "maxLength": 10000
          },
          "claimRefs": {
            "$ref": "#/$defs/idList"
          },
          "sourceRefs": {
            "$ref": "#/$defs/idList"
          }
        }
      }
    },
    "claimRefs": {
      "$ref": "#/$defs/idList"
    },
    "sourceRefs": {
      "$ref": "#/$defs/idList"
    },
    "estimatedDurationSeconds": {
      "type": "number",
      "exclusiveMinimum": 0,
      "maximum": 7200
    },
    "disclaimerRefs": {
      "type": "array",
      "uniqueItems": true,
      "items": {
        "$ref": "#/$defs/id"
      }
    },
    "dossierRevision": {
      "type": "integer",
      "minimum": 1
    },
    "dossierSha256": {
      "$ref": "#/$defs/sha256"
    },
    "approval": {
      "type": "object",
      "additionalProperties": false,
      "required": [
        "status",
        "approvedAt",
        "approvedRevision",
        "notes"
      ],
      "properties": {
        "status": {
          "enum": [
            "draft",
            "pending",
            "approved",
            "changes-requested"
          ]
        },
        "approvedAt": {
          "oneOf": [
            {
              "$ref": "#/$defs/timestamp"
            },
            {
              "type": "null"
            }
          ]
        },
        "approvedRevision": {
          "type": [
            "integer",
            "null"
          ],
          "minimum": 1
        },
        "notes": {
          "type": "string",
          "maxLength": 2000
        }
      }
    },
    "generatedAt": {
      "$ref": "#/$defs/timestamp"
    }
  },
  "$defs": {
    "id": {
      "type": "string",
      "pattern": "^[a-z][a-z0-9-]{2,95}$"
    },
    "episodeId": {
      "type": "string",
      "pattern": "^episode-[a-z0-9][a-z0-9-]{7,95}$"
    },
    "idList": {
      "type": "array",
      "minItems": 1,
      "uniqueItems": true,
      "items": {
        "$ref": "#/$defs/id"
      }
    },
    "timestamp": {
      "type": "string",
      "pattern": "^\\d{4}-\\d{2}-\\d{2}T\\d{2}:\\d{2}:\\d{2}(?:\\.\\d{3})?Z$"
    },
    "sha256": {
      "type": "string",
      "pattern": "^[a-f0-9]{64}$"
    }
  }
}
